{
  "$schema": "https://json-schema.org/draft/2020-12/schema",
  "title": "Recommendation",
  "type": "object",
  "required": [
    "id",
    "incident_id",
    "summary",
    "risk",
    "confidence",
    "evidence_ids",
    "steps",
    "rollback",
    "verification",
    "state"
  ],
  "properties": {
    "id": {
      "type": "string"
    },
    "incident_id": {
      "type": "string"
    },
    "summary": {
      "type": "string"
    },
    "risk": {
      "type": "string",
      "enum": [
        "low",
        "medium",
        "high",
        "critical"
      ]
    },
    "confidence": {
      "type": "number",
      "minimum": 0,
      "maximum": 1
    },
    "evidence_ids": {
      "type": "array",
      "items": {
        "type": "string"
      }
    },
    "alternatives": {
      "type": "array",
      "items": {
        "type": "string"
      }
    },
    "preconditions": {
      "type": "array",
      "items": {
        "type": "string"
      }
    },
    "backup_snapshot_guidance": {
      "type": "array",
      "items": {
        "type": "string"
      }
    },
    "steps": {
      "type": "array",
      "items": {
        "type": "string"
      }
    },
    "rollback": {
      "type": "array",
      "items": {
        "type": "string"
      }
    },
    "verification": {
      "type": "array",
      "items": {
        "type": "string"
      }
    },
    "required_approvals": {
      "type": "array",
      "items": {
        "type": "string"
      }
    },
    "state": {
      "type": "string"
    },
    "expires_at": {
      "type": [
        "string",
        "null"
      ],
      "format": "date-time"
    }
  }
}
